{"digests":{"catalog":"e2df5cd545c0beb1f3cb21793526b9ba86c79cacaccefcd1ed893d3f8704a809","contract":"fdfc2c8d751cbc4a0a525e78949af6659345bc140fe247a2a1f65ea768b6b474","intent_artifact":"b18e6dd5e3cc2a0e7d46084a54cf6890df6163fdae93075b163c6bfec1fd5e5c","profiles":"e7ec4dac2dad7f222a41c8aff81a8d07d77d02aee99c488faa049f51eefae2af","vocabulary":"45484504f06968c6b4ac812c24b9f1b6e47e1d34ba21fefebde8dd85d1290fa9"},"packs":[{"evaluation_input":{"path":"WK-2327.pack-sha256-07bb8ef8757a3179c3d876aa343bc0b081ad6cc666ba8d477cb5ec265b9dd98a.evaluation-input.json"},"profile_id":"proof.operation.forbidden-noninvocation","profile_version":"4.0.0","requested_intents":["controlled-proof-intent.forbidden-operation-noninvocation"],"source_digests":{"adequacy_declaration":"99a8eb4f2e74120aa5cf98d151e5c360e3c26c55c0f2d70c10b1ed3d459c67f4","adequacy_result":"1c15b3a73659bb5fbf7fd57ac74d740d1247ac9a61f91e2f4c81743cafab77f4","admission":"6500402f064de70b963eedf17d296530f5bc8ff520f7bcaa8c762ae90857230a","evaluation_input":"86155ced1645d5281a77a396f4ed4f1160654286f44d8772bdf270b740502397","guarantee":"37c6bfcae8528804a5a06d4013d6595e92742ce97e982ef126790662e6acf7df","profile":"d33c7c3eb034b334d4bcda5705c3334a98e408ecf91663b03bab81b60058956d"}},{"evaluation_input":{"path":"WK-2327.pack-sha256-2e51045951ac5093c562a3b4f31a53353259af2a21a8a3469df9c85d8a07bf1c.evaluation-input.json"},"profile_id":"proof.verification.test-validity","profile_version":"8.0.0","requested_intents":["controlled-proof-intent.test-verification-validity"],"source_digests":{"adequacy_declaration":"6c565e1b0947c76869e6b1189f3c15b92b3d94f67c2df6f342404df0568c98f2","adequacy_result":"5d5e0ed5be481558e232a13e80b3cff02a52812f51d580361801bb68f2f4e8c3","admission":"611ec606a579c2b855fb4db5e57464a31777cbd29d31ef13801c4c98eae3d760","evaluation_input":"b6577c7264faaaaa44b30e6be7816398afcc3b8368cab6e10bd936192968aded","guarantee":"7d2ba6e9dadfc1c004033b05e08f74d25e0f0b430beabe4e58ed5e033c1fa9ab","profile":"a36f644f8cc70547b8c1090a631e92f8ee7f35e982ce9b9245350d8a381bbaa6"}}],"requested_intents":["controlled-proof-intent.forbidden-operation-noninvocation","controlled-proof-intent.test-verification-validity"],"schema_version":"controlled-contract-proof-plan.v1"}
