{"digests":{"catalog":"e2df5cd545c0beb1f3cb21793526b9ba86c79cacaccefcd1ed893d3f8704a809","contract":"d40a1dad4a43f218c517d58e7bba1526f22b09adadcc7630a8a776980f9f88f3","intent_artifact":"b18e6dd5e3cc2a0e7d46084a54cf6890df6163fdae93075b163c6bfec1fd5e5c","profiles":"e7ec4dac2dad7f222a41c8aff81a8d07d77d02aee99c488faa049f51eefae2af","vocabulary":"45484504f06968c6b4ac812c24b9f1b6e47e1d34ba21fefebde8dd85d1290fa9"},"packs":[],"requested_intents":[],"schema_version":"controlled-contract-proof-plan.v1"}
